university_name	short_name	is_private	rank	rank_ind	census_region	missing	paid_leave_len_woman	paid_leave_len_woman_units	paid_leave_weeks_woman	relief_woman	paid_leave_len_man	paid_leave_len_man_units	paid_leave_weeks_man	relief_man	link	notes	date
Santa Clara University	Santa Clara	1	153.65	164	West	0	24	week	24	Not specified	12	week	12	Not specified	https://santaclarauniv.a.guidespark.com/videos/32671	Interesting. SCU uses payment from sick leave and supplements this with their own payment to reach equalivalent pay during the leave of absence. https://www.scu.edu/media/offices/human-resources/documents/benefits/Faculty-Parental-Leave-Final.pdf; https://www.scu.edu/media/offices/human-resources/documents/benefits/Faculty-Maternity-Timeline.pdf	2/24/18
Simon Fraser University	Simon Fraser	0	78.97	65	Canada	0	35	week	35	All duties	18	week	18	All duties	https://www.sfu.ca/policies/gazette/academic/a31-05.html	"Called 'paid leave' for both. Receive 95% salary. Can then opt to extend to 50 weeks with the difference being unpaid. Must work for 1 year after returning, or repay the salary benefit."	2/24/18
"Southern Illinois University, Carbondale"	Souther Illinois	0	148.23	155	Midwest	0	0	week	0	All duties	0	week	0	Not specified	http://policies.siu.edu/personnel-policies/chapter6/leavefap.php	"Mothers may take up to 6 weeks of sick leave (from their accured sick leave days), otherwise FMLA and both parents can use accrued vacation time (maximum 50-56 days)."	2/24/18
Southern Methodist University	Southern Methodist	1	80.22	70	South	0	6	week	6	All duties	0	week	0	Not specified	https://www.smu.edu/BusinessFinance/HR/BenefitsAndWellness/HealthAndOtherBenefits/Leave-of-Absence-FMLA	"Mothers get 6 weeks paid leave for natural / 8 weeks for C-section birth. Unclear if this is staff only or faculty too; faculty handbook behind a login wall. Otherwise, FMLA"	2/24/18
Stanford University	Stanford	1	2.23	0	West	0	1	term	10	All duties	1	term	10	Just teaching	https://facultyhandbook.stanford.edu/handbooks/faculty-handbook/chapter-3/subchapter-5/page-3-5-1	"Mothers can apply for 4 months 'maternal disability' leave (paid), and both parents can request a teaching release for 1 term. See also: https://facultyhandbook.stanford.edu/handbooks/faculty-handbook/chapter-3/subchapter-5/page-3-5-5"	2/24/18
"State University of New York, Albany"	SUNY Albany	0	110.18	103	Northeast	0	0	week	0	Not specified	0	week	0	Not specified	https://www.albany.edu/hr/maternity.php	"Mothers can use accrued (paid) sick leave to cover up to 6 weeks for natural / 8 weeks for C-section birth. Otherwise, vacation days and FMLA"	2/24/18
"State University of New York, Binghamton"	SUNY Binghamton	0	124.35	116	Northeast	0	0	week	0	Not specified	0	week	0	Not specified	https://www.binghamton.edu/human-resources/leaves/leaves-childcare-general-parameters.html	"Mothers can use accrued (paid) sick leave to cover up to 6 weeks for natural / 8 weeks for C-section birth. Otherwise, vacation days and FMLA"	2/24/18
"State University of New York, Buffalo"	SUNY Buffalo	0	82.16	74	Northeast	0	0	week	0	Not specified	0	week	0	Not specified	http://www.buffalo.edu/administrative-services/for-faculty-staff/time-attendance/leave.html	"Mothers can use accrued (paid) sick leave to cover up to 6 weeks for natural / 8 weeks for C-section birth. Otherwise, vacation days. Allows unpaid 'child rearing leave' for up to 7 months."	2/24/18
"State University of New York, Stony Brook"	SUNY Stony Brook	0	36.01	30	Northeast	0	0	week	0	Not specified	0	week	0	Not specified	https://www.stonybrook.edu/hr/misc/ul/state/facpro_childcare.shtml	"Mothers can use accrued (paid) sick leave to cover up to 6 weeks for natural / 8 weeks for C-section birth. Otherwise, vacation days and FMLA"	2/24/18
Stevens Institute of Technology	Stevens Inst. of Tech.	1	82.4	75	Northeast	0	6	week	6	All duties	2	week	2	All duties	https://www.stevens.edu/sites/stevens_edu/files/files/hr/compliance/PTO_Policy_Highlights_20161001-Maternity-Parental.pdf	.	2/24/18
Syracuse University	Syracuse	0	56.74	47	Northeast	0	1	term	16	Just teaching	1	term	16	Just teaching	https://policies.syr.edu/policies/faculty-teaching-and-research/leave-faculty-parental/	"Mothers can get 6-8 weeks paid leave, or 1 term of teaching relief (if their postpartum 'disability' extends 4 weeks into a term); Mothers/fathers who are 'primary caregivers' can request a 'reduction of work load by 50% (including one course relief), or half a semester without formal duties'"	2/24/18
Temple University	Temple	0	156.16	166	Northeast	0	8	week	8	All duties	8	week	8	All duties	https://www.temple.edu/hr/faculty/family_friendly_policies.htm	"Parents (either gender) are eligible for 6-8 weeks of paid sick leave (6 for natural birth, 8 for c-section), with remaining time up to 12 weeks unpaid under FMLA. (Confirmed with Temple Benefits office by phone.)"	2/28/18
Texas A&M	Texas A&M	0	63.14	51	South	0	0	week	0	Not specified	0	week	0	Not specified	https://employees.tamu.edu/benefits/leave/parental/	"Mothers can use accrued (paid) sick or vacation leave to cover up to the 12 weeks allowed under FMLA; Father have same benefit, but require approval to take more than 3 days of leave"	2/28/18
Texas Tech University	Texas Tech	0	164.46	177	South	0	0	week	0	Not specified	0	week	0	Not specified	https://www.depts.ttu.edu/hr/EmpBenefits/Leave/Index.php	"FMLA only, and taking it requires spending all available accrued sick and vacation leave"	2/28/18
Toyota Technological Institute at Chicago	Toyota Tech. Inst. at Chicago	1	126.16	121	Midwest	0	1	term	16	All duties	1	term	16	All duties	http://www.ttic.edu/dl/faculty_handbook.pdf	"(page 50) 1 quarter of paid leave (all duties); if both parents are faculty, they must split the 1 term, and not take it concurrently"	2/28/18
Tufts University	Tufts	1	146.5	153	Northeast	0	2	week	2	All duties	2	week	2	All duties	http://ase.tufts.edu/faculty/handbook/leave/definitionOfTerms.htm#parentalLeave	"Parents (either gender) are eligible for 6-8 weeks of paid sick leave (6 for natural birth, 8 for c-section), with remaining time up to 12 weeks unpaid under FMLA. (Confirmed with Temple Benefits office by phone.)"	2/28/18
UC Berkeley	UC Berkeley	0	2.31	1	West	0	2	term	32	Just teaching	1	term	16	Just teaching	http://ucop.edu/academic-personnel-programs/_files/apm/apm-760.pdf	"(Chart I) Mothers: 6 weeks paid childbearing leave, extensible to 4 months unpaid leave; Fathers: FMLA and sick/vacation time; Both can opt for duty modifications (teaching relief, full pay) for remaing time in 1 semester (father) or 2 semesters (mother) if they certify they are primary care giver (>50% effort)"	2/28/18
UC Davis	UC Davis	0	61.39	50	West	0	2	term	22	Just teaching	1	term	11	Just teaching	http://ucop.edu/academic-personnel-programs/_files/apm/apm-760.pdf	"(Chart I) Mothers: 6 weeks paid childbearing leave, extensible to 4 months unpaid leave; Fathers: FMLA and sick/vacation time; Both can opt for duty modifications (teaching relief, full pay) for remaing time in 1 semester (father) or 2 semesters (mother) if they certify they are primary care giver (>50% effort)"	2/28/18
UC Irvine	UC Irvine	0	37.36	31	West	0	2	term	22	Just teaching	1	term	11	Just teaching	http://ucop.edu/academic-personnel-programs/_files/apm/apm-760.pdf	"(Chart I) Mothers: 6 weeks paid childbearing leave, extensible to 4 months unpaid leave; Fathers: FMLA and sick/vacation time; Both can opt for duty modifications (teaching relief, full pay) for remaing time in 1 semester (father) or 2 semesters (mother) if they certify they are primary care giver (>50% effort)"	2/28/18
UC Riverside	UC Riverside	0	71.14	59	West	0	2	term	20	Just teaching	1	term	10	Just teaching	http://ucop.edu/academic-personnel-programs/_files/apm/apm-760.pdf	"(Chart I) Mothers: 6 weeks paid childbearing leave, extensible to 4 months unpaid leave; Fathers: FMLA and sick/vacation time; Both can opt for duty modifications (teaching relief, full pay) for remaing time in 1 semester (father) or 2 semesters (mother) if they certify they are primary care giver (>50% effort)"	2/28/18
UC San Diego	UC San Diego	0	27.93	25	West	0	2	term	22	Just teaching	1	term	11	Just teaching	http://ucop.edu/academic-personnel-programs/_files/apm/apm-760.pdf	"(Chart I) Mothers: 6 weeks paid childbearing leave, extensible to 4 months unpaid leave; Fathers: FMLA and sick/vacation time; Both can opt for duty modifications (teaching relief, full pay) for remaing time in 1 semester (father) or 2 semesters (mother) if they certify they are primary care giver (>50% effort)"	2/28/18
UC Santa Barbara	UC Santa Barbara	0	56.76	48	West	0	2	term	20	Just teaching	1	term	10	Just teaching	http://ucop.edu/academic-personnel-programs/_files/apm/apm-760.pdf	"(Chart I) Mothers: 6 weeks paid childbearing leave, extensible to 4 months unpaid leave; Fathers: FMLA and sick/vacation time; Both can opt for duty modifications (teaching relief, full pay) for remaing time in 1 semester (father) or 2 semesters (mother) if they certify they are primary care giver (>50% effort)"	2/28/18
UC Santa Cruz	UC Santa Cruz	0	79.49	68	West	0	2	term	20	Just teaching	1	term	10	Just teaching	http://ucop.edu/academic-personnel-programs/_files/apm/apm-760.pdf	"(Chart I) Mothers: 6 weeks paid childbearing leave, extensible to 4 months unpaid leave; Fathers: FMLA and sick/vacation time; Both can opt for duty modifications (teaching relief, full pay) for remaing time in 1 semester (father) or 2 semesters (mother) if they certify they are primary care giver (>50% effort)"	2/28/18
UCLA	UCLA	0	17.82	14	West	0	2	term	22	Just teaching	1	term	11	Just teaching	http://ucop.edu/academic-personnel-programs/_files/apm/apm-760.pdf	"(Chart I) Mothers: 6 weeks paid childbearing leave, extensible to 4 months unpaid leave; Fathers: FMLA and sick/vacation time; Both can opt for duty modifications (teaching relief, full pay) for remaing time in 1 semester (father) or 2 semesters (mother) if they certify they are primary care giver (>50% effort)"	2/28/18
"University of Alabama, Birmingham"	"Alabama, Birmingham"	0	153.44	163	South	0	4	week	4	Not specified	4	week	4	Not specified	http://www.uab.edu/policies/content/Pages/UAB-HR-POL-0000776.aspx		3/13/18
"University of Alabama, Huntsville"	"Alabama, Huntsville"	0	163.89	175	South	0	0		0		0		0		https://www.uah.edu/images/administrative/human-resources/staff_handbook_final_rev_121516.pdf	The University does not have a separate âmaternity leaveâ policy. Leave is taken from sick/vaction time.	3/13/18
"University of Alabama, Tuscaloosa"	"Alabama, Tuscaloosa"	0	186.81	203	South	0	8	week	8	Not specified	0		0		http://hr.ua.edu/work-life-resources/leave-policies	Maternity leave only	3/13/18
University of Alberta	Alberta	0	86.24	79	Canada	0	15	week	15	Not specified	10	week	10	Not specified	http://www.hrs.ualberta.ca/en/Benefits/MedicalOtherLeaves/MaternityParentalLeave/~/media/hrs/Benefits/MedicalOtherLeaves/ChildbirthTipsheetRegContStaff.pdf	Paid at 95% full-time rate	3/13/18
University of Arizona	Arizona	0	40.57	38	West	0	6	week	6	Not specified	6	week	6	Not specified	http://policy.arizona.edu/human-resources/parental-leave-policy	Leave can be extended by using other forms of paid leave.	3/13/18
"University of Arkansas, Fayetteville"	"Arkansas, Fayetteville"	0	178.7	193	South	0	0		0		0		0		https://hr.uark.edu/working/handbook/7-paid-unpaid-leave/7-7.php	"Treated as any other unpaid leave, except employee is not required to exhaust paid leave."	3/13/18
"University of Arkansas, Little Rock"	"Arkansas, Little Rock"	0	181.14	198	South	0	0		0		0		0		http://ualr.edu/humanresources/family-and-medical-leave-act-fmla/	FMLA	3/13/18
University of Bridgeport	Bridgeport	1	178.73	194	Northeast	1	NA		NA		NA		NA		Not publicly accessible	Could not find publicly-accessible documentation of the policy	3/13/18
University of British Columbia	British Columbia	0	51.75	45	Canada	0	26	week	26	Not specified	10	week	10	Not specified	http://www.hr.ubc.ca/wellbeing-benefits/benefits/details/vacation-leaves/maternity-parental-adoptive-leave/maternity-parental-and-adoption-leave-for-academic-executives-academic-exec-faculty-postdoctoral-fellows-employees/	Specifies leave for birth mothers, birth fathers, and adopting parents. Postdoctoral fellows are also eligible.	4/18/18
University of Calgary	Calgary	0	100.27	90	Canada	0	18	week	18	Not specified	20	day	4	Not specified	http://www.ucalgary.ca/hr/files/hr/tucfa-collective-agreement.pdf	Paid leave for adoption is also 18 weeks but does not indicate differences by gender.	3/13/18
University of Central Florida	Central Florida	0	81.51	71	South	0	1	term	16	All duties	1	term	16	All duties	https://facultyexcellence.ucf.edu/paid-parental-leave/	"'When on full leave of absence, a faculty member shall not participate in any UCF teaching, research or service. The faculty member is expected to be devoting themselves full time to their new parenthood.'"	3/13/18
University of Chicago	Chicago	1	18.82	16	Midwest	0	1	term	12	Just teaching	1	term	12	Just teaching	https://provost.uchicago.edu/handbook/clause/parental-leave-faculty	"Primary caregiver status required for men to use the policy. Paid leave for one quarter, and teaching reduction for 1 course (if 3-5/yr) or 2 courses (if 6+/yr)."	3/13/18
University of Cincinnati	Cincinatti	0	79.33	66	Midwest	0	6	week	6	All duties	6	week	6	All duties	http://www.uc.edu/news/NR.aspx?id=21071	Relieved from teaching duties for the whole term.	3/13/18
"University of Colorado, Boulder"	"Colorado, Boulder"	0	68.17	55	West	0	18	week	18	Not specified	18	week	18	Not specified	https://www.cu.edu/ope/aps/5019	"Faculty utilize all sick leave, drop down to 50% pay after"	3/13/18
"University of Colorado, Colorado Springs"	"Colorado, Colorado Springs"	0	169.16	183	West	0	18	week	18	Not specified	18	week	18	Not specified	https://www.cu.edu/ope/aps/5019	"Faculty utilize all sick leave, drop down to 50% pay after"	3/13/18
"University of Colorado, Denver"	"Colorado, Denver"	0	125.51	118	West	0	18	week	18	Not specified	18	week	18	Not specified	https://www.cu.edu/ope/aps/5019	"Faculty utilize all sick leave, drop down to 50% pay after"	3/13/18
University of Connecticut	Connecticut	0	108.32	99	Northeast	0	6	month	1.5	Not specified	6	month	1.5	Not specified	https://hr.uconn.edu/2015/05/26/faculty-medical-leave-guidelines/	Six months is the minimum paid leave. Leave length increases with time spent at university.	3/13/18
University of Delaware	Delaware	0	87.66	83	South	0	0		0		0		0		https://sites.udel.edu/generalcounsel/policies/parental-leave/	FMLA. Paid disability leave is available.	3/13/18
University of Denver	Denver	1	133.81	131	West	0	1	term	10	Not specified	1	term	10	Not specified	https://www.du.edu/human-resources/employee-support/leaves.html		3/13/18
University of Florida	Florida	0	94.94	86	South	0	0		0		0		0		http://www.hr.ufl.edu/benefits-rewards/wp-content/uploads/forms/parental_info_procedure.pdf	6 advanced weeks borrowed from sick or vacation leave.	3/13/18
University of Georgia	Georgia	0	145.66	151	South	0	0		0		0		0		http://policies.uga.edu/Human-Resources/Time-away-from-work/Sick-Leave/Maternity-Leave/	"Mother can apply for paid/unpaid time off for recovery, no specific policy beyond FMLA, though."	3/13/18
"University of Hawaii, Manoa"	Hawaii	0	154.88	165	West	0	0		0		0		0		https://manoa.hawaii.edu/ovcaa/faculty/leaves/pdf/bor_uhpa_contract.pdf	Faculty have the right to unpaid leave	3/13/18
University of Houston	Houston	0	64.97	52	South	0	0		0		0		0		http://www.uh.edu/af/universityservices/policies/mapp/02/020201.pdf	"FMLA, must use paid leave first"	3/13/18
"University of Idaho, Moscow"	Idaho	0	164.22	176	West	0	0		0		0		0		https://www.uidaho.edu/human-resources/benefits/time-away-from-work/family-and-medical-leave	FMLA	3/13/18
"University of Illinois, Chicago"	"Illinois, Chicago"	0	79.33	67	Midwest	0	2	week	2	Not specified	2	week	2	Not specified	https://www.hr.uillinois.edu/cms/One.aspx?portalId=4292&pageId=5628	Employees who resign employment before or at the expiration of the parental leave normally shall be required to reimburse the University for the cost of wages paid during the leave.	3/13/18
"University of Illinois, Urbana Champaign"	"Illinois, Urbana-Champaign"	0	13.43	10	Midwest	0	2	week	2	Not specified	2	week	2	Not specified	https://www.hr.uillinois.edu/cms/One.aspx?portalId=4292&pageId=5628	Employees who resign employment before or at the expiration of the parental leave normally shall be required to reimburse the University for the cost of wages paid during the leave.	3/13/18
University of Iowa	Iowa	0	87.49	82	Midwest	0	0		0		0		0		https://opsmanual.uiowa.edu/human-resources/paid-absences#22.8	"Policy references birth mothers only: 'If an employee's accumulated sick leave is insufficient to cover the 6-week period of disability, the leave balance will be charged, at the employee's request, to vacation time, compensatory time, or a leave of absence without pay. '"	3/13/18
"University of Kansas, Lawrence"	Kansas	0	74.4	60	Midwest	0	0		0		0		0		http://policy.ku.edu/human-resources/family-medical-leave	"'During an employeeâs approved FMLA period, the employee is required to exhaust all paid leave balances before going onto FMLA leave without pay status.'"	3/13/18
University of Kentucky	Kentucky	0	123.11	115	South	0	0		0		0		0		https://www.uky.edu/hr/employee-relations/family-medical-leave/faqs-family-and-medical-leave	"'You are paid only if you have appropriate accrued temporary disability leave or vacation leave days. If not, the FML will be without pay.'"	3/13/18
"University of Louisiana, Lafayette"	"Louisiana, Lafayette"	0	100.62	91	South	0	0		0		0		0		https://academicaffairs.louisiana.edu/sites/academicaffairs/files/Section%20VI-Faculty%20Staff%20Benefits%281%29.pdf	FMLA	3/13/18
University of Louisville	Louisville	0	179.12	195	South	0	0		0		0		0		https://sharepoint.louisville.edu/sites/policies/library/SitePages/Human%20Resources/Family%20and%20Medical%20Leave%20Policy.aspx	Must use all accrued sick leave and then go on unpaid leave.	3/13/18
University of Maine	Maine	0	135.62	134	Northeast	0	0		0		0		0		http://www.maine.edu/about-the-system/system-office/human-resources/family-leave-policies/	Mothers are typically granted six weeks of disability leave following the birth of a child	3/13/18
University of Manitoba	Manitoba	0	129.12	125	Canada	1	NA		NA		NA		NA		Not publicly accessible	Could not find publicly-accessible documentation of the policy	3/13/18
"University of Maryland, Baltimore County"	"Maryland, Baltimore County"	0	134.13	132	South	0	8	week	8	Not specified	8	week	8	Not specified	http://www.umaryland.edu/academicaffairs/policies/parentalleave/	"Faculty must use all accrued leave, and the university will supplement their time up to the full 8 weeks."	3/13/18
"University of Maryland, College Park"	"Maryland, College Park"	0	28.65	26	South	0	8	week	8	Not specified	8	week	8	Not specified	http://www.umaryland.edu/academicaffairs/policies/parentalleave/	"Faculty must use all accrued leave, and the university will supplement their time up to the full 8 weeks."	3/13/18
"University of Massachusetts, Amherst"	UMass Amherst	0	26.95	24	Northeast	0	0		0		0		0		http://umassmsp.org/contract/	Part of collective bargaining agreement	3/13/18
"University of Massachusetts, Boston"	UMass Boston	0	143.2	148	Northeast	0	0		0		0		0		https://hr.umb.edu/benefits/medical-leave	From the leave request form: LEAVE WILL BE PAID ONLY IF EMPLOYEE HAS SUFFICIENT ACCRUALS TO COVER PART OR ALL OF ABSENCE.	3/13/18
"University of Massachusetts, Lowell"	UMass Lowell	0	151.46	160	Northeast	0	0		0		0		0		http://faculty.uml.edu/msp/contract/documents/contract2014/2014-Contract-Article-XX.pdf	"Faculty can take paid leave, using accrued sick leave or borrowing+paying it back later"	3/13/18
University of Memphis	Memphis	0	137.66	137	South	0	6	week	6	Other	6	week	6	Other	https://umwa.memphis.edu/umpolicies/UM1853.htm	"Wording is confusing regarding modified duties, though relief seems to be from all duties."	3/13/18
University of Miami	Miami	1	120.24	113	South	1	NA		NA		NA		NA		https://my.hr.miami.edu/benefits-and-wellness/work-life/paid-parental-leave/index.html	"Link implies some paid relief, but we can't access it"	3/13/18
University of Michigan	Michigan	0	29.37	27	Midwest	0	1	term	16	Other	1	term	16	Other	http://spg.umich.edu/policy/201.93	Relief is from 'at least' teaching.	3/12/18
"University of Minnesota, Minneapolis"	Minnesota	0	38.94	35	Midwest	0	6	week	6	Not specified	2	week	2	Not specified	https://policy.umn.edu/hr/parentalleave	.	3/12/18
University of Mississippi	Mississippi	0	165.5	179	South	0	0		0		0		0		https://policies.olemiss.edu/ShowDetails.jsp?istatPara=1&policyObjidPara=10659147	"FMLA for faculty; graduate students have a separate policy, though: https://gradschool.wp.olemiss.edu/wp-content/uploads/sites/36/2015/04/Parental-Leave-Policy.pdf"	3/12/18
"University of Missouri, Columbia"	"Missouri, Columbia"	0	139.45	141	Midwest	0	0		0		0		0		https://www.umsystem.edu/ums/rules/collected_rules/personnel/ch340/340.070_faculty_leave	FMLA	3/12/18
"University of Missouri, Kansas City"	"Missouri, Kansas City"	0	138.72	140	Midwest	0	0		0		0		0		https://www.umsystem.edu/ums/rules/collected_rules/personnel/ch340/340.070_faculty_leave	FMLA	3/12/18
University of Montreal	Montreal 	0	78.54	64	Canada	1	NA		NA		NA		NA		Not publicly accessible	.	
"University of Nebraska, Lincoln"	"Nebraska, Lincoln"	0	130.66	127	Midwest	0	0		0		0		0		https://hr.unl.edu/policies/parental-leave/	FMLA; leave is deducted from sick leave.	3/12/18
"University of Nebraska, Omaha"	"Nebraska, Omaha"	0	179.97	196	Midwest	0	0		0		0		0		https://www.unomaha.edu/human-resources/benefits/family-medical-leave.php	6-8 weeks of paid sick leave for recovering mothers.	3/12/18
"University of Nevada, Las Vegas"	"Nevada, Las Vegas"	0	171.62	186	West	0	0		0		0		0		https://www.unlv.edu/hr/benefits/leave/fmla	FMLA	3/12/18
"University of Nevada, Reno"	"Nevada, Reno"	0	182.47	202	West	0	0		0		0		0		https://www.unr.edu/Documents/administration-finance/hr/hr-leave/ParentalLeavePractice.pdf	FMLA	3/12/18
University of New Brunswick	New Brunswick	0	158.12	171	Canada	0	37	week	37	Not specified	37	week	37	Not specified	http://www.unb.ca/hr/_resources/policies/parental.pdf	37 weeks at 95% pay	3/12/18
University of New Hampshire	New Hampshire	0	156.98	169	Northeast	0	12	week	12	Not specified	12	week	12	Not specified	https://www.unh.edu/provost/section-3-faculty-employment-policies	.	3/12/18
University of New Mexico	New Mexico	0	81.65	72	West	0	1	term	16	Just teaching	1	term	16	Just teaching	https://handbook.unm.edu/policies/section-c/leave-absence/c215.html	"Primary or coequal care-giver. Research and advising are expected to continue during parental leave, though not during 'any period of medically required leave.'"	3/12/18
"University of North Carolina, Chapel Hill"	"North Carolina, Chapel Hill"	0	29.55	28	South	0	1	term	16	Not specified	1	term	16	Not specified	https://academicpersonnel.unc.edu/faculty-policies-procedures-guidelines/leave/faculty-serious-illness-major-disability-and-parental-leave-policy/	Primary care-giver. 1 semester for those with teaching responsibilities. 15 weeks for individuals without teaching responsibilities.	3/12/18
"University of North Carolina, Charlotte"	"North Carolina, Charlotte"	0	152.67	162	South	0	0		0		0		0		https://hr.uncc.edu/pims/leave-without-pay	.	3/12/18
"University of North Texas, Denton"	North Texas	0	186.84	204	South	0	0		0		0		0		https://policy.unt.edu/sites/default/files/05.061_ParentalLeave_2005.pdf	Must use all available sick leave	3/12/18
University of Notre Dame	Notre Dame	1	98.8	88	Midwest	0	1	term	15	Just teaching	0	week	0		https://facultyhandbook.nd.edu/university-policies/fmla/	.	4/12/18
University of Oklahoma	Oklahoma	0	116.24	109	South	0	0		0		0		0		https://hr.ou.edu/Employees/Holidays-Time-Off-Leave/Family-Medical-Leave-FMLA#4605869-eligibility	FMLA	3/12/18
University of Oregon	Oregon	0	54.86	46	West	0	12	week	12	Not specified	12	week	12	Not specified	https://hr.uoregon.edu/hr-programs-services/employee-leaves/parental/represented-faculty/parental-leave-faq-represented	"Second six weeks are drawn from sick leave, which faculty are allowed to borrow from themselves in the event that they don't have enough built up in order to cover the six weeks outright"	3/12/18
University of Ottawa	Ottawa	0	107.42	98	Canada	0	18	week	18	Not specified	18	week	18	Not specified	https://hrdocrh.uottawa.ca/info/en-ca/apuo/leave-child-care.html	"Slight difference for birth mothers vs others, but the effect appears to be equivalent: 18 weeks paid leave (between university and employment insurance)"	3/13/18
University of Pennsylvania	Pennslyvania	1	15.31	12	Northeast	0	1	term	16	Just teaching	1	term	16	Just teaching	http://provost.upenn.edu/uploads/media_items/ii-e-4-faculty-parental-policy.original.pdf	"Primary caregiver of a child newly arrived in his/her home is entitled, without reduction in pay, to a reduction in teaching duties amounting to a fifty percent reduction in a given academic year."	4/12/18
University of Pittsburgh	Pittsburgh	0	46.81	43	Northeast	0	12	week	12	Not specified	4	week	4	Not specified	http://provost.pitt.edu/faculty/faculty-guidelines-and-processes/faculty-medical-and-family-leave-fmfl	4 weeks paid family leave; women get another 8 for a c-section and 6 for vaginal birth. I wrote 12 for women to indicate the maximum benefit.	3/13/18
University of Regina	Regina	0	130.03	126	Canada	0	50	week	50	Not specified	35	week	35	Not specified	https://www.uregina.ca/hr/faculty-staff/apt-staff/parental.html	.	3/13/18
University of Rhode Island	Rhode Island	0	126	120	Northeast	0	0		0		0		0		https://web.uri.edu/hr/personnel-policies/maternity-leave/	Full release while on unpaid leave	3/13/18
